id,en,ch,manualTag,tranlatedTag,tatoebaEnId,tatoebaChId,wordDifficulty,syllablesCount,combinedDifficulty,isOneHundredPoints
1148,There was a cottage on the side of the hill.,山坡上有一間小屋。,,地點,48731,847791,6,11,15.2,TRUE
1149,Tom and Mary have been here for three hours.,湯姆和瑪麗已經在這裡待了三個小時。,,地點,2640458,6131476,3,10,12.1,TRUE
1150,"As long as you keep quiet, you can stay here.",只要你保持安靜，你就可以留在這裡。,,地點,788263,779494,3,10,12.1,TRUE
1151,Do you know of any good restaurant near here?,你知道這兒附近有什麼好餐廳嗎?,,地點,61364,390531,1,12,12.7,TRUE
1152,"If it rains tomorrow, I'll just stay at home.",如果明天下雨，我就待在家。,,地點,386758,333425,3,11,13.1,TRUE
1153,She rested her head on her mother's shoulder.,她把頭靠在她母親的肩上。,,地點,316932,5883328,1,11,11.7,TRUE
1155,There's no space in the room for another bed.,這間房間沒有空間再放一張床了。,,地點,682053,900052,3,11,13.1,TRUE
1156,Time is the most precious thing in the world.,時間是世界上最寶貴的東西。,,地點,2676772,464922,5,10,13.5,TRUE
1157,Tom happened to meet Mary at the supermarket.,湯姆在超市偶遇瑪麗。,,地點,1028776,1372497,3,14,16.1,TRUE
1158,What do you say to taking a walk in the park?,去公園散步你覺得怎麼樣？,,地點,240457,405266,0,12,12,TRUE
1159,Car exhaust causes serious pollution in towns.,汽車廢棄在城鎮裡造成了嚴重的污染。,,地點,265533,5715189,10,13,20,TRUE
1160,"Excuse me, I have to get off at the next stop.",對不起，我要在下一站下。,,地點,51487,462014,4,12,14.8,TRUE
1161,He regrets not having worked harder at school.,他後悔在學校時沒用功讀書。,,地點,294797,332453,5,12,15.5,TRUE
1162,I know that you are learning French at school.,我知道你在學校學法語。,,地點,2451195,6103233,4,10,12.8,TRUE
1163,I met him by chance on the train this morning.,今天早上我和他在火車上巧遇。,,地點,242253,1420611,1,11,11.7,TRUE
1164,"In the United States, school buses are yellow.",在美國，校車是黃色的。,,地點,682511,816555,3,13,15.1,TRUE
1165,My mother looked at me with tears in her eyes.,我媽媽眼含著淚看我。,,地點,852892,5739305,2,13,14.4,TRUE
1166,The air is thin at the top of a high mountain.,山頂上空氣稀薄。,,地點,241217,6120787,4,12,14.8,TRUE
1167,There is a big supermarket in my neighborhood.,在我家附近有一間大型超市。,,地點,65569,2615139,4,13,15.8,TRUE
1168,Tom wondered why there was a dog in his house.,湯姆覺得奇怪，為什麼他的房子裡有隻狗。,,地點,2537839,5670776,4,12,14.8,TRUE
1169,A fire broke out in my neighborhood last night.,昨晚我鄰居家著火了。,,地點,244732,332903,5,11,14.5,TRUE
1170,A truck was standing in the middle of the road.,路中間有一輛卡車。,,地點,36949,487597,4,11,13.8,TRUE
1171,Friends are like flowers in the garden of life.,朋友就像生命之園裡的花朵。,,地點,795786,796654,1,11,11.7,TRUE
1172,He spent his sixtieth birthday in the hospital.,他在醫院裡度國了他的十六歲生日。,,地點,803282,6098440,8,12,17.6,TRUE
1173,I had no idea there'd be this many people here.,我沒想到這裡有這麼多人。,,地點,2640236,5581771,3,12,14.1,TRUE
1174,It cost him 50 dollars to rent a car in Hawaii.,他花了50美元在夏威夷租了一輛汽車。,,地點,292450,1426449,4,14,16.8,TRUE
1175,It was a bag that I lost in the room yesterday.,那是我昨天在房裡掉了的包包。,,地點,246783,6065385,3,13,15.1,TRUE
1176,The house I bought is pretty far from downtown.,我買的房子離市中心比較遠。,,地點,2165609,785028,4,11,13.8,TRUE
1177,The man reading a paper over there is my uncle.,在那裡看報紙的男人是我叔叔。,,地點,32070,336724,2,13,14.4,TRUE
1178,The teacher assembled the students in the hall.,老師在禮堂把學生們集合起來。,,地點,48683,897263,5,12,15.5,TRUE
1179,They buried him in the graveyard by the church.,他們把他埋葬在教堂旁的墓園。,,地點,307408,918020,11,13,20.7,TRUE
1180,An old man was resting in the shade of the tree.,一個老人在樹蔭下休息。,,地點,413018,869943,5,12,15.5,TRUE
1181,"As long as you are here, we might as well begin.","既然你在這裡, 那我們就開始吧。",,地點,17705,772370,4,12,14.8,TRUE
1182,Do you know if my father is still in the office?,你知道我的父親還在辦公室嗎？,,地點,816223,816692,3,13,15.1,TRUE
1183,He is very influential in the world of medicine.,他在醫學界有很大的影響力。,,地點,1229515,408847,7,14,18.9,TRUE
1184,How long do you plan on staying in this country?,你打算在這個國家待多久？,,地點,1211535,333990,0,14,14,TRUE
1185,It is said that treasure is buried in this area.,據說這個區域埋著財寶。,,地點,59605,336188,6,13,17.2,TRUE
1187,The minimum wage in Okinawa is 642 yen per hour.,沖繩的最低時薪是每小時642日元。,,地點,828804,829686,13,20,29.1,TRUE
1189,There were a lot of excited fans in the stadium.,體育場裡有很多興奮的球迷。,,地點,324095,2317166,6,13,17.2,TRUE
1190,We want to be on the first bus tomorrow morning.,我想搭明天早上第一班公車。,,地點,2032040,5989211,2,13,14.4,TRUE
1191,"When I was a child, I used to swim in that pond.",當我還是個孩子的時候，我在這個泳池裡游過泳。,,地點,404101,4845038,1,13,13.7,TRUE
1192,My train left at 7 and arrived in New York at 10.,我乘的火車七點出發，十點抵達紐約。,,地點,453005,444668,5,15,18.5,TRUE
1193,"There are more than 4,000 languages in the world.",全世界有超過4000多種的語言。,,地點,1490655,1883017,4,13,15.8,TRUE
1194,"Tom is in the living room, sleeping on the couch.",湯姆在客廳，躺在長沙發上睡覺。,,地點,2494735,5942091,5,12,15.5,TRUE
1196,You can ask the child that is playing over there.,你可以問問在那裡玩的孩子。,,地點,815808,816767,3,13,15.1,TRUE
1197,A bird in the hand is better than two in the bush.,一鳥在手勝過二鳥在林。,,地點,464908,771150,5,13,16.5,TRUE
1198,"Every time he comes here, he orders the same dish.",每次他來這裡都點一樣的菜。,,地點,894789,4757626,1,14,14.7,TRUE
1199,Is it all right to take pictures in this building?,我們可以在大樓裡拍照嗎？,,地點,59447,343315,2,13,14.4,TRUE
1200,Jupiter is the largest planet in the Solar System.,木星是太陽系中最大的行星。,,地點,499549,4265892,14,14,23.8,TRUE
1201,She helped her father with the work in the garden.,她幫她爸爸做了園藝。,,地點,316803,333539,0,13,13,TRUE
1202,There was no one in the room besides Tom and Mary.,除了湯姆和瑪麗，房間裡沒有人。,,地點,1030029,5624957,4,14,16.8,TRUE
1203,Life in prison is worse than the life of an animal.,監獄生活比畜牲還不如。,,地點,2149,345894,4,14,16.8,TRUE
1204,There's a bottle of white wine in the refrigerator.,冰箱裡有一瓶白葡萄酒。,,地點,2712539,6098446,5,13,16.5,TRUE
1205,A beautiful woman was seated one row in front of me.,一個美麗的女人坐在我前面一排。,,地點,318149,830393,3,15,17.1,TRUE
1206,"All of a sudden, three dogs appeared in front of us.",突然之間，三隻狗出現在我們面前。,,地點,19634,830482,4,14,16.8,TRUE
1207,Did you know that some foxes lived on this mountain?,你知道有狐狸住在這座山上嗎?,,地點,59183,907302,3,13,15.1,TRUE
1208,Let's meet at the station at eight tomorrow morning.,明早八點車站見。,,地點,323184,4972514,1,13,13.7,TRUE
1209,"Quite by chance, I met my old friend at the airport.",很幸運地，我在機場遇到了我的老朋友。,,地點,32529,334850,2,12,13.4,TRUE
1210,She went over the list to see if her name was there.,她走過去看看她的名字是否在名單上。,,地點,314741,830382,3,13,15.1,TRUE
1211,The ice on the lake is too thin to bear your weight.,湖上的冰太薄了，承受不了你的重量。,,地點,48127,333758,4,12,14.8,TRUE
1212,The wind blew too hard for them to play in the park.,風刮得太大，他們沒法在公園裡玩了。,,地點,319665,333203,3,12,14.1,TRUE
1213,There's a lot of trash on the far bank of the river.,河對岸有很多垃圾。,,地點,273194,830372,4,13,15.8,TRUE
1214,How much of what I've written here do you understand?,我在這裡寫的東西，你了解了多少？,,地點,776915,776935,0,13,13,TRUE
1216,It is said that his father died in a foreign country.,據說他爸爸在國外去世了。,,地點,285290,332895,3,15,17.1,TRUE
1217,The bus stopped suddenly in the middle of the street.,公車突然在路中央停了下來。,,地點,35294,774510,4,13,15.8,TRUE
1218,The girl was sobbing in the corner of the schoolroom.,女孩在教室的角落啜泣。,,地點,267859,5363945,12,13,21.4,TRUE
1219,Tom bought a camera at a store not too far from here.,湯姆在離這裡不遠的一家店裡買了一台相機。,,地點,1026999,4845057,3,14,16.1,TRUE
1220,We just have to make sure Tom is planning to be here.,我們只是需要確認湯姆會來這裡。,,地點,1893788,5418980,3,13,15.1,TRUE
1222,I didn't know who was going to meet me at the airport.,我不知道誰會來機場見我。,,地點,1887191,5617195,2,14,15.4,TRUE
1223,I took him to the most expensive restaurant on campus.,我帶他去了校園裡最貴的餐廳。,,地點,425898,426408,6,15,19.2,TRUE
1224,That was the first time that a man walked on the moon.,那是人類第一次在月球上行走。,,地點,43103,333857,2,13,14.4,TRUE
1226,You look pale. You had better lie down in bed at once.,你看上去很蒼白。你最好立刻去床上躺會兒。,,地點,16225,611541,5,13,16.5,TRUE
1227,"Iron the inside of collars first, and then the outside.",先熨領子的裡面，然後是外面。,,地點,65250,1394904,5,14,17.5,TRUE
1228,"The moment I held the baby in my arms, it began to cry.",我一把孩子抱在手裡，他就開始哭了。,,地點,247083,802849,3,16,18.1,TRUE
1229,I told you not to talk about the matter in her presence.,我跟你說過她在的時候不要說這件事。,,地點,309524,465025,4,15,17.8,TRUE
1230,Some people do not like to deposit their money in banks.,有些人不喜歡把錢存在銀行。,,地點,18439,487652,5,14,17.5,TRUE
1231,Almost everyone in our village is related to one another.,我們村里所有的村民幾乎彼此都是親戚。,,地點,2174963,2174210,5,18,21.5,TRUE
1232,No other mountain in the world is as tall as Mt. Everest.,世界上任何山峰都沒有像珠穆朗瑪峰那麼高。,,地點,388012,343363,3,16,18.1,TRUE
1233,She would often go to the theater when she was in London.,她在倫敦的時候，曾經常去劇院。,,地點,312447,863947,2,15,16.4,TRUE
1234,What have you done with my pen? It was here a minute ago.,你對我的鋼筆做了什麼事? 一分鐘前它還在這裡。,,地點,33560,793606,2,15,16.4,TRUE
1235,He was discovered unconscious on the floor of the kitchen.,他被人發現倒在廚房的地板上，不省人事。,,地點,383528,343972,9,16,22.3,TRUE
1236,The Eiffel Tower is in the same city as the Louvre Museum.,埃菲爾鐵塔和盧浮宮在同一座城市。,,地點,479194,526553,15,16,26.5,TRUE
1237,The train will probably arrive at the station before noon.,火車大概會在中午前到站。,,地點,326247,336637,5,15,18.5,TRUE
1238,We enjoyed watching the fireworks on a bridge last summer.,去年夏天，我們在橋上看煙火看得很過癮。,,地點,244689,335171,4,17,19.8,TRUE
1239,"Yesterday, an explosion occurred at the fireworks factory.",昨晚，煙火廠發生了爆炸。,,地點,1697764,1694988,9,18,24.3,TRUE
1241,They wanted a wedding picture in front of the Eiffel Tower.,他們想在艾菲爾鐵塔前面拍張結婚照。,,地點,681034,899986,9,16,22.3,TRUE
1242,Tom has no idea what to do with all the junk in his garage.,湯姆不知道拿他車庫的那些垃圾怎麼辦。,,地點,1884500,7774809,6,16,20.2,TRUE
1243,Everyone in the room checked their watches at the same time.,房間裡的所有人都同時看了看自己的手錶。,,地點,1841719,5091179,3,15,17.1,TRUE
1245,"I noticed a note on my desk, but I do not know who wrote it.","我發現了我辦公桌上有張字條, 但是我不知道是誰寫的。",,地點,788260,780256,3,17,19.1,TRUE
1246,"If you stay at a big hotel, you can use their swimming pool.",若你住到在大旅館，就能使用他們的游泳池。,,地點,275492,483964,2,15,16.4,TRUE
1247,Tom took Mary to the hospital on the back of his motorcycle.,湯姆把瑪麗放到他的摩托車上送到醫院。,,地點,1877562,5574619,4,16,18.8,TRUE
1248,"When I was a child, I spent most of my time indoors reading.",當我是個孩子的時候，我把大部分時間都花在了在室內讀書上。,,地點,1540876,1506823,5,15,18.5,TRUE
1249,The old church on the hill dates back to the twelfth century.,山上的老教堂的歷史可以追溯到12世紀。,,地點,19865,830347,10,15,22,TRUE
1250,"Ever since she fell in the kitchen, she hasn't been all there.",自從她在廚房裡摔倒後，她不曾再到那裡。,,地點,275400,830327,3,15,17.1,TRUE
1251,I heard someone in the crowd outside the station call my name.,我聽到車站外的人群中有人在叫我的名字。,,地點,25969,875037,4,15,17.8,TRUE
1252,Some of the bluest water in the world is found in Crater Lake.,世界上最藍的水在魁特湖。,,地點,672243,760819,8,15,20.6,TRUE
1253,"For the time being, my sister is an assistant in a supermarket.",目前，我妹妹在一家超市當收銀員。,,地點,280037,333180,4,18,20.8,TRUE
1254,Is it true that your family will travel in Hokkaido? I envy you.,你們家去北海道旅遊是真的麼？我好羨慕。,,地點,240198,666398,8,19,24.6,TRUE
1255,The conflict between blacks and whites in the city became worse.,在這個城市，白人和黑人間的衝突愈演愈烈。,,地點,246109,333584,4,16,18.8,TRUE
1256,Maybe my grandchild will be the first person to set foot on Mars.,我的孫子可能會是登陸火星的第一人。,,地點,593655,819696,8,15,20.6,TRUE
1257,The leaves of the trees in the garden have turned completely red.,花園裡樹上的葉子已經完全變紅了。,,地點,278499,1394790,4,18,20.8,TRUE
1258,Tom probably knows where we can get something to eat around here.,湯姆應該知道這附近哪裡有東西吃。,,地點,2745789,2771060,4,17,19.8,TRUE
1259,A bookstore in that location wouldn't make enough money to survive.,那個地點的書店無法賺到足夠生存下去的錢。,,地點,41330,830411,7,18,22.9,TRUE
1260,He was always annoyed in the city by noises of one sort or another.,他在城市裡一直受到噪音或者其他的干擾。,,地點,279450,333001,7,22,26.9,TRUE
1261,His wife is in the hospital because she was injured in a car crash.,他的妻子在醫院裡，因為她在一場車禍中受傷了。,,地點,286367,780238,7,19,23.9,TRUE
1262,Tom reached for a dictionary that was on the very top of the shelf.,湯姆把手伸向了書架上最高的一本詞典。,,地點,2162245,2143980,4,19,21.8,TRUE
1263,"According to the guidebook, this is the best restaurant around here.",根據旅遊書，這是這附近最好的餐館。,,地點,326921,830424,14,18,27.8,TRUE
1264,"In some countries, the punishment for treason can be life in prison.",在一些國家，叛國罪的懲罰可以是終身監禁。,,地點,682228,873443,10,18,25,TRUE
1265,The death penalty had been done away with in many states in the USA.,死刑在美國的很多州都被廢除了。,,地點,67568,333229,6,20,24.2,TRUE
1266,I think you will find it convenient to put a short-cut on the desktop.,我想你遲早會知道在桌面建立一個捷徑有多麼方便。,,地點,393814,1767755,10,18,25,TRUE
1267,"While I was reading in bed last night, I fell asleep with the light on.",我昨晚在床上看書的時候，開著燈就睡了。,,地點,244847,1446793,4,17,19.8,TRUE
1268,"In the U.S., most people can vote when they reach eighteen years of age.",在美國，大多數人在滿十八歲以後可以投票。,,地點,67628,5670805,4,15,17.8,TRUE
1269,"After asking for my key at the front desk, I took the elevator to my floor.",我在櫃檯拿了鑰匙，然後就搭電梯去了我房間的樓層。,,地點,34053,431516,4,21,23.8,TRUE
1270,English has now become the common language of several nations in the world.,英文現已成為世界上許多國家的通用語言了。,,地點,26274,791672,4,20,22.8,TRUE
1271,"Outside the school, she saw people with no homes living in cardboard boxes.",在校外，她看到沒有家的人們住在紙板箱裡。,,地點,21486,5576844,7,18,22.9,TRUE
1272,"The statue of Hachiko, the faithful dog, stands in front of Shibuya Station.",忠犬八公的雕像佇立在澀谷站前。,,地點,277560,1394995,18,20,32.6,TRUE
1273,"To the man who only has a hammer in the toolkit, every problem looks like a nail.",對工具箱裡只有一把榔頭的人來說，所有的問題都像釘子。,,地點,2292,811119,10,23,30,TRUE
1274,"Tom went swimming in the river, but when he got out, his clothes had been stolen.",湯姆去河裡游泳，但當他出來時，他的衣服被偷了。,,地點,1635552,7771950,4,20,22.8,TRUE
1275,"In London, the police are always worried about finding a bomb on the train or subway.",在倫敦，警察總是會擔心在列車上發現炸彈。,,地點,29285,5363943,5,23,26.5,TRUE
1276,Tom's mother is a nurse at the hospital that's across the street from where Mary lives.,湯姆的媽媽是一名護士，她所在的醫院就在瑪麗住的那條街的對面。,,地點,1092144,5091200,3,22,24.1,TRUE
1277,"When we started out, our band could only find small clubs in small cities that would hire us.",當我們剛起步時，只有小城市裡的小俱樂部雇傭願意我們樂隊。,,地點,954630,5624958,5,21,24.5,TRUE
1278,"Last year in the Philippines, earthquakes and tidal waves resulted in the deaths of more than 6,000 people.",去年在菲律賓，地震和海嘯造成了超過6000人的死亡。,,地點,1493945,5552136,16,29,40.2,TRUE
1279,I was searched by the customs officers at the airport.,我在機場被海關人員搜查。,,地點,257406,727982,5,15,18.5,TRUE
1280,A plane is flying above the city.,一架飛機在這個城市上空飛行。,,地點,277864,797017,3,9,11.1,TRUE
1281,He is studying in the library now.,他現在在圖書館讀書。,,地點,296560,888403,2,10,11.4,TRUE
1282,The baby is sleeping in the cradle.,嬰兒正在搖籃裡睡覺。,,地點,272415,900701,4,9,11.8,TRUE
1283,A friend of mine is studying abroad.,我有一位朋友正在國外留學。,,地點,252011,793222,3,9,11.1,TRUE
1284,My sister is cooking in the kitchen.,我妹妹正在廚房做飯。,,地點,245594,401032,1,11,11.7,TRUE
1285,The petals are floating on the water.,花瓣浮在水面上。,,地點,23743,760833,8,10,15.6,TRUE
1286,The roses in the garden are blooming.,花園裡的玫瑰正盛開著。,,地點,460376,895630,6,10,14.2,TRUE
1287,We are all longing for peace in the world.,誰都希望世界和平。,,地點,276550,2029473,4,10,12.8,TRUE
1288,They are arriving here soon from Hong Kong.,他們就快從香港抵達了。,,地點,306542,333313,10,10,17,TRUE
1289,Smoking is prohibited on the train.,在火車上禁止吸煙。,,地點,794651,798326,8,10,15.6,TRUE
1290,Tom lived there.,湯姆住在這裡。,,地點,2237180,5613703,1,4,4.7,TRUE
1291,Tom hid under the table.,湯姆躲在桌子底下。,,地點,37241,332772,3,6,8.1,TRUE
1292,I arrived here yesterday.,我昨天到這裡的。,,地點,493788,819435,2,8,9.4,TRUE
1293,He is studying at his desk.,他正在他的書桌上讀書。,,地點,513531,848716,1,7,7.7,TRUE
1294,You're here.,你在這裡。,,地點,2202941,7768155,1,2,2.7,TRUE
1295,I am a stranger here.,我在這裡是個外人。,,地點,253493,941138,3,6,8.1,TRUE
1296,He's a student at this college.,他是這所大學的學生。,,地點,289933,882572,1,8,8.7,TRUE
1297,I'll eat it here.,我會在這裡吃。,,地點,449107,824569,1,4,4.7,TRUE
1298,You have a point there.,喔！你提到一個重點了。,,地點,36518,1426355,1,5,5.7,TRUE
1299,He often eats breakfast there.,他常常在那裡吃早餐。,,地點,290089,834364,1,7,7.7,TRUE
1300,I'd like seats on the first floor.,我想要一樓的座位。,,地點,73193,894004,3,7,9.1,TRUE
1302,I spent twelve hours on the train.,我在火車上待了12小時。,,地點,2085,503110,1,7,7.7,TRUE
1303,The embassy is located next to the Supreme Court.,大使館就在最高法院旁邊。,,地點,275707,2680428,11,14,21.7,TRUE
1305,America is a country of immigrants.,美國是一個移民國家。,"日常, 學校",國家,67541,844610,5,13,16.5,TRUE
1306,What is the population of India?,印度的人口有多少？,,國家,65727,866059,6,10,14.2,TRUE
1307,I am from China.,我來自中國。,,國家,1578570,3845373,1,5,5.7,TRUE
1308,I come from China.,我是從中國來的。,,國家,717392,717391,0,5,5,TRUE
1309,I'm from Singapore.,我是從新加坡來的。,,國家,52481,746065,8,5,10.6,TRUE
1310,I come from England.,我來自英國。,,國家,66622,917951,0,5,5,TRUE
1311,He comes from England.,他來自英格蘭。,,國家,288977,3289577,0,6,6,TRUE
1312,She may have missed the 7:00 train.,她可能錯過了七點的火車。,,"可能性,時間",310210,894388,1,11,11.7,TRUE
1313,He may have left for Kyoto.,他可能已經離開京都了。,,"可能性,城市",295279,848451,2,7,8.4,TRUE
1314,She may come.,她也許來。,,可能性,388731,826112,0,3,3,TRUE
1315,She might come.,她也許會來。,,可能性,388733,826122,3,3,5.1,TRUE
1316,I might say yes.,我可能會說是。,,可能性,2387228,5945148,3,4,6.1,TRUE
1317,He may have lost his way.,他可能已經迷路了。,,可能性,302061,332783,2,6,7.4,TRUE
1318,We may be late for school.,我們上學可能會遲到。,,可能性,262943,793899,3,6,8.1,TRUE
1319,He may have missed the train.,他可能錯過了火車。,,可能性,301802,390544,1,7,7.7,TRUE
1320,He is likely to win the game.,他有可能贏得比賽。,,可能性,298286,332558,1,9,9.7,TRUE
1321,He may come and see us tonight.,他今天晚上可能來看我們。,,可能性,296645,880285,0,8,8,TRUE
1322,This may not be a real diamond.,這可能不是一顆真的鑽石。,,可能性,55393,905870,4,8,10.8,TRUE
1323,Can you come for dinner tonight?,你今天晚上能來吃飯嗎？,,可能性,243195,842468,2,8,9.4,TRUE
1324,He may have taken the wrong train.,他可能搭錯火車了。,,可能性,301807,885522,1,8,8.7,TRUE
1325,Something may have happened to him.,他可能發生了什麼事情。,,可能性,25175,858752,2,10,11.4,TRUE
1326,Something might have happened to her.,她可能出了什麼事。,,可能性,34622,332431,5,10,13.5,TRUE
1327,He is likely to be late again.,他可能又會遲到。,,可能性,288063,881245,3,10,12.1,TRUE
1328,Maybe he will be a good teacher.,也許他會是一個好老師。,,可能性,40569,891028,3,8,10.1,TRUE
1329,That patient may die at any time.,那個病人隨時會死。,,可能性,48884,332829,4,9,11.8,TRUE
1330,That child may have been kidnapped on his way home.,那個孩子可能在回家的路上被綁架了。,,可能性,47494,335102,7,12,16.9,TRUE
1331,He wore a mask so that no one could recognize him.,他戴著面具以至於沒有人認出他。,,原因,300389,785112,6,13,17.2,TRUE
1332,Europeans like to drink wine.,歐洲人喜歡喝酒。,,"刻板印象,酒精飲料",497135,782716,7,7,11.9,TRUE
1333,Lincoln set the slaves free.,林肯釋放了奴隸。,,"刻板印象,英文姓氏",29645,835366,11,7,14.7,TRUE
1334,The best hairdressers are gay.,最好的理髮師是同性戀。,,刻板印象,602024,818869,9,7,13.3,TRUE
1335,Animals are afraid of fire.,動物怕火。,,刻板印象,280244,512178,2,8,9.4,TRUE
1336,I am four months pregnant.,我懷孕四個月了。,,出生,2235,389818,5,6,9.5,TRUE
1337,She gave birth to twin girls.,她生了對雙胞胎女兒。,,出生,315512,805622,5,6,9.5,TRUE
1338,You're going to be a mommy.,你要當媽了。,,出生,1121820,6064595,3,7,9.1,TRUE
1339,She gave birth to a baby boy.,她生下了一個男嬰。,,出生,308883,818946,2,8,9.4,TRUE
1340,She gave birth to a healthy baby.,她生下了一個健康的嬰兒。,,出生,313450,893986,4,9,11.8,TRUE
1341,I'm pregnant.,我懷孕了。,,出生,348596,333464,5,3,6.5,TRUE
1342,One out of 455 women doesn't realize she's pregnant until the twentieth week of pregnancy.,455名婦女中會有一名直到懷孕第二十週前沒有意識到自己懷孕。,,出生,825631,827641,10,28,35,TRUE
1343,I don't feel very well. I should go home.,我覺得不太舒服。我該回家了。,"日常, 職場, 學校",兩個句子,2362084,6119245,2,11,12.4,TRUE
1344,You said you were in trouble. How can I help?,你說你有困難。我能幫忙嗎？,"日常, 職場, 學校",兩個句子,1994413,6089785,3,10,12.1,TRUE
1346,I have to go shopping. I'll be back in an hour.,我該去買東西了，我一小時後回來。,"日常, 職場",兩個句子,1650,501524,3,12,14.1,TRUE
1347,I miss you. I need to see you. Could I come over?,我想你。我需要見你。我能來嗎？,"日常, 戀愛",兩個句子,953531,1311593,3,13,15.1,TRUE
1348,"Even now, I occasionally think I'd like to see you. Not the you that you are today, but the you I remember from the past.",即使是現在，我偶爾還是想見到你。不是今天的你，而是我記憶中曾經的你。,"日常, 戀愛",兩個句子,1230933,2567478,6,33,37.2,TRUE
1349,Mary isn't really sick. She's only pretending to be sick.,瑪麗不是真病。她只是裝病。,"日常, 學校, 職場",兩個句子,1356721,5663596,5,16,19.5,TRUE
