id,en,ch,manualTag,tranlatedTag,tatoebaEnId,tatoebaChId,wordDifficulty,syllablesCount,combinedDifficulty,isOneHundredPoints
885,I am a citizen of Sapporo.,我是札幌的市民。,,城市,257857,819268,10,10,17,TRUE
886,Kyoto has many universities.,京都有很多所大學。,,城市,19318,333508,4,10,12.8,TRUE
887,He arrived in Tokyo yesterday.,他昨天抵達東京。,,城市,244644,834377,2,10,11.4,TRUE
888,He is flying to Paris tomorrow.,他明天將飛往巴黎。,,城市,304122,848714,2,9,10.4,TRUE
889,He is leaving Chicago tomorrow.,他明天將離開芝加哥。,,城市,288703,833804,9,10,16.3,TRUE
890,I am leaving for Tokyo tomorrow.,我明天將出發去東京。,,城市,323451,848860,3,10,12.1,TRUE
891,He will arrive in Paris tomorrow.,他明天將抵達巴黎。,,城市,304090,848528,3,10,12.1,TRUE
892,He's always been living in Tokyo.,他一直住在東京。,,城市,290295,779473,2,9,10.4,TRUE
893,All sorts of people live in Tokyo.,各式各樣的人住在東京。,,城市,279740,868252,3,8,10.1,TRUE
894,Is this the right train for Tokyo?,這是開往東京的火車嗎?,,城市,279806,891146,2,8,9.4,TRUE
895,Kyoto and Boston are sister cities.,京都和波士頓是姐妹城市。,,城市,2698592,5842613,7,10,14.9,TRUE
896,He has a brother who lives in Tokyo.,他有個住在東京的兄弟。,,城市,284881,7771888,0,11,11,TRUE
897,Kyoto is famous for its old temples.,京都以古寺有名。,,城市,19296,797142,5,10,13.5,TRUE
898,My brother goes to college in Tokyo.,我兄弟在東京上大學。,,城市,250727,804832,0,10,10,TRUE
900,He is now either in Rome or in Paris.,他不是在羅馬，就是在巴黎。,,城市,296530,887660,3,11,13.1,TRUE
901,Tom is leaving Kobe tomorrow morning.,湯姆明天早上離開神戶。,,城市,37005,781112,6,10,14.2,TRUE
902,What is the fare from Osaka to Akita?,從大阪到秋田要多少錢？,,城市,275677,336186,12,12,20.4,TRUE
903,Kyoto depends on the tourist industry.,京都依賴旅遊業。,,城市,19300,798173,7,11,15.9,TRUE
904,She went either to London or to Paris.,她不是去了倫敦就是巴黎。,,城市,312445,863913,1,11,11.7,TRUE
905,Karuizawa is famous as a summer resort.,輕井澤是著名的避暑勝地。,,城市,238417,797041,14,13,22.8,TRUE
906,I want you to not go to Boston with Tom.,我要你別和湯姆去波士頓。,,城市,2026592,3383343,8,11,16.6,TRUE
907,Spring is the best season to visit Kyoto.,春天是訪問京都最好的季節。,,城市,266956,782267,2,11,12.4,TRUE
908,What time will the train get to Yokohama?,火車什麼時候到橫濱？,,城市,1481671,335130,7,11,15.9,TRUE
909,The streets in Tokyo are full on Saturdays.,週六，東京街上人滿為患。,,城市,681040,900003,3,11,13.1,TRUE
910,"Having lived in Tokyo, I know the city well.",因為住過東京，我對這個城市非常了解。,,城市,279744,336436,0,13,13,TRUE
911,London's climate differs from that of Tokyo.,倫敦的氣候和東京不同。,,城市,29287,336471,6,11,15.2,TRUE
912,This plane flies between Osaka and Hakodate.,這架飛機往返於大阪和函館之間。,,城市,57454,903487,10,12,19,TRUE
913,Our music teacher advised me to visit Vienna.,我們的音樂老師建議我去維也納看看。,,城市,25423,6148370,10,14,21,TRUE
914,I don't believe the child came to Tokyo alone.,我不相信孩子能獨自到東京。,,城市,59094,336938,3,13,15.1,TRUE
915,She told me that she would go to Paris in August.,她跟我說八月份她會去巴黎。,,城市,314132,461999,0,13,13,TRUE
917,She came to Tokyo when she was eighteen years old.,她18歲的時候來到東京。,,城市,464656,1397135,2,12,13.4,TRUE
918,"The longer I stayed in Paris, the more I liked it.",在巴黎待得越久，我就越喜歡巴黎。,,城市,255430,1423332,1,16,16.7,TRUE
919,Tom has made up his mind to go to Boston to study.,湯姆已經下定決心要去波士頓唸書。,,城市,1025356,4805778,8,14,19.6,TRUE
920,This company is listed on the Paris stock exchange.,這家公司在巴黎證券交易所上市了。,,城市,1159921,805223,10,14,21,TRUE
921,"When I first came back to Boston, I was really lonely.",當我第一次回波士頓時，我非常孤獨。,,城市,3148256,5595228,9,15,21.3,TRUE
923,Tom was able to make himself understood in French when he visited Paris.,在巴黎，沒有人能夠理解湯姆的法文。,,城市,1024015,1228959,4,19,21.8,TRUE
924,He and his sisters are currently living in Tokyo.,他和他的姐妹們目前都住在東京。,,城市,1477144,332641,4,14,16.8,TRUE
925,People from Madrid are weird.,從馬德里來的人都很怪。,,城市,1558,334432,13,6,15.1,TRUE
927,I miss Boston.,我想念波士頓。,,城市,2387234,5548480,7,4,8.9,TRUE
928,Tom misses Boston.,湯姆想念波士頓了。,,城市,2862240,7772594,8,5,10.6,TRUE
929,What do you have in your bag?,你的袋子裡有什麼？,,地點,69790,895591,0,7,7,TRUE
931,He lives just across the road.,他就住在馬路對面。,,地點,302062,848677,3,8,10.1,TRUE
932,I had hoped to meet you there.,我曾希望在那裡遇見你。,,地點,71154,889642,1,8,8.7,TRUE
933,I'll pick you up at your home.,我會去你家接你。,,地點,70798,472851,3,7,9.1,TRUE
934,Let's take a walk in the park.,讓我們在公園裡散步吧。,,地點,240456,894051,1,7,7.7,TRUE
935,No one lives in this building.,沒有人住在這棟樓裡。,,地點,451748,444814,1,8,8.7,TRUE
936,She stayed at home by herself.,她獨自留在家裡。,,地點,310101,857987,0,9,9,TRUE
937,She will be here this evening.,她今天晚上將在這裡。,,地點,243198,850691,2,8,9.4,TRUE
938,Someone locked me in the room.,有人把我鎖在這房間裡。,,地點,2174940,2174223,3,8,10.1,TRUE
939,The watch on the desk is mine.,桌上的手錶是我的。,,地點,20535,6059533,1,7,7.7,TRUE
940,There is a park near my house.,我家附近有一個公園。,,地點,250499,907216,1,7,7.7,TRUE
941,There's a hole in this bucket.,這個桶子上有個洞。,,地點,60712,865485,4,7,9.8,TRUE
942,They moved here two years ago.,他們兩年前搬到了這裡。,,地點,305426,868397,2,8,9.4,TRUE
943,Put the book there.,把書放在那裡。,,地點,2149075,759616,1,4,4.7,TRUE
944,Get down on the floor!,趴在地上！,,地點,433524,833806,2,5,6.4,TRUE
945,Wait here for a while.,在這裡等一會下。,,地點,53434,784412,2,5,6.4,TRUE
946,Don't leave me here alone.,別把我一個人留在這裡。,,地點,2481334,6111967,3,7,9.1,TRUE
947,Don't put books on the table.,不要把書放在那張桌子上。,,地點,525756,836372,2,7,8.4,TRUE
948,Don't talk in the reading room.,閱覽室裡禁止說話。,,地點,270707,727946,1,8,8.7,TRUE
949,Change trains at the next station.,在下一站換乘火車。,,地點,264246,836356,3,7,9.1,TRUE
950,Don't put anything in the bag.,不要把所有東西都放進包包裡。,,地點,689892,1878375,3,8,10.1,TRUE
951,Put the chair in front of the desk.,把椅子放在桌子前面。,,地點,681033,899982,2,8,9.4,TRUE
952,Tell me what you have in your hand.,告訴我你手裡有什麼。,,地點,265903,426881,0,8,8,TRUE
953,Go away before they see you here.,在他們看見你之前離開這裡。,,地點,1452803,2499983,1,9,9.7,TRUE
954,Don't show your face around here again.,你不要再出現在這裡了。,,地點,541986,889626,3,10,12.1,TRUE
955,Don't stand near me.,不要站在我旁邊。,,地點,410592,819452,1,5,5.7,TRUE
956,Don't throw trash here.,別在這裡亂丟垃圾。,,地點,61822,1397009,5,5,8.5,TRUE
957,Don't put anything on top of the box.,不要放任何東西在箱子上面。,,地點,44472,4816290,3,10,12.1,TRUE
958,Don't put anything on top of the box.,不要在箱子上面放任何東西。,,地點,44472,4816291,3,10,12.1,TRUE
961,Be careful not to drive the wrong way on a one-way street.,小心不要在單行道逆向行駛。,,地點,682503,787558,3,15,17.1,TRUE
962,He is at home.,他在家裡。,,地點,816868,816870,1,4,4.7,TRUE
963,Can I sit here?,我可以坐這裡嗎？,,地點,1537275,4757682,1,4,4.7,TRUE
964,I lived in Rome.,我住在羅馬。,,地點,767497,5570721,0,5,5,TRUE
965,Tom was at home.,湯姆在家。,,地點,2648914,6321889,2,4,5.4,TRUE
966,Can I sleep here?,我能在這裡睡覺嗎？,,地點,1911934,6860866,1,4,4.7,TRUE
968,I live near here.,我住在這附近。,,地點,413831,826271,0,4,4,TRUE
970,Why are you here?,你為什麼在這？,,地點,1481997,3742607,1,4,4.7,TRUE
971,He's not here yet.,他還沒到這裡。,,地點,2768628,6673090,2,4,5.4,TRUE
972,Tom sent me there.,湯姆送我去了那裡。,,地點,2262278,6075694,2,4,5.4,TRUE
973,Tom works at home.,湯姆在家工作。,,地點,1765311,6075699,1,4,4.7,TRUE
974,Let's get off here.,我們在這裡下車吧。,,地點,61894,332792,2,4,5.4,TRUE
975,We can't talk here.,我們不能在這裡談。,,地點,1954967,5900366,1,5,5.7,TRUE
976,What's in this bag?,這個袋子裡是什麼？,,地點,450136,825906,0,4,4,TRUE
977,Why were you there?,你為什麼在那裡？,,地點,411315,771615,1,4,4.7,TRUE
978,Could you sign here?,你能在這裡簽名嗎？,,地點,61821,415645,3,4,6.1,TRUE
979,There's a book here.,這裡有一本書。,,地點,515536,825137,0,4,4,TRUE
980,Your shoes are here.,你的鞋在這裡。,,地點,17265,373457,2,4,5.4,TRUE
981,But you're not there.,但你不在那裡。,,地點,53546,824529,2,4,5.4,TRUE
982,He eats lunch at a cafeteria.,他在自助餐廳吃午餐。,,地點,289576,864379,0,9,9,TRUE
983,She lived at 56 Russell Square.,她住在羅素廣場56號。,,地點,327964,332600,9,10,16.3,TRUE
984,Has anybody here been to Hawaii?,這裡有人去過夏威夷嗎？,,地點,361589,787368,3,9,11.1,TRUE
986,Do you have a table on the patio?,你院子裡有桌子嗎?,,地點,502617,874491,7,9,13.9,TRUE
987,He worked in a big city hospital.,他在一間大型的市立醫院工作。,,地點,1477086,882987,0,11,11,TRUE
988,I often go swimming in the river.,我常常在河裡游泳。,,地點,255880,875338,1,10,10.7,TRUE
989,I usually stay indoors on Sunday.,星期天我通常待在家裡。,,地點,281863,858070,3,10,12.1,TRUE
990,Mary set the basket on the table.,瑪麗把籃子放在桌子上了。,,地點,32000,894032,3,9,11.1,TRUE
991,My plan is to study in Australia.,我的計劃是去澳洲唸書。,,地點,250747,892519,4,10,12.8,TRUE
992,The tablecloth is in the cabinet.,桌巾在櫥櫃裡。,,地點,39640,868452,12,10,18.4,TRUE
993,We grow vegetables in our garden.,我們在我們的花園裡種菜。,,地點,249095,869909,2,10,11.4,TRUE
994,Did you enjoy staying in Hokkaido?,你喜歡住在北海道嗎？,,地點,321281,842463,3,11,13.1,TRUE
999,I saw a beautiful waterfall there.,我看見那裡有做很美的瀑布。,,地點,1499021,335279,2,10,11.4,TRUE
1001,My camera was stolen on the train.,我的相機在火車上被偷了。,,地點,2846107,476640,3,10,12.1,TRUE
1002,Our library is on the third floor.,我們的圖書館在三樓。,,地點,262600,894042,3,9,11.1,TRUE
1003,She is a clerk in the supermarket.,她是超市的店員。,,地點,310949,333668,3,10,12.1,TRUE
1004,She is eager to live in Australia.,她非常希望能住在澳洲。,,地點,310890,1397315,7,10,14.9,TRUE
1005,She put the magazine on the table.,她把雜誌放在桌上。,,地點,39637,891755,3,9,11.1,TRUE
1006,She visited her husband in prison.,她探望了她在監獄裡的丈夫。,,地點,313374,862875,3,10,12.1,TRUE
1007,She was visibly afraid to be here.,很明顯她害怕待在這裡。,,地點,718049,718385,5,10,13.5,TRUE
1008,The pharmacy is near the hospital.,藥局在醫院附近。,,地點,462858,1225668,7,10,14.9,TRUE
1009,There is a basket under the table.,桌子底下有一個籃子。,,地點,63769,907537,2,9,10.4,TRUE
1010,There is a television in the room.,房裡有台電視。,,地點,44247,804887,3,10,12.1,TRUE
1011,There wasn't anybody in the house.,沒有人在家。,,地點,24161,869920,4,9,11.8,TRUE
1012,He carried a rifle on his shoulder.,他把來福槍背在他的肩上。,,地點,295994,881233,5,9,12.5,TRUE
1013,He has plenty of money in the bank.,他在銀行裡有大量存款。,,地點,295550,1416288,3,10,12.1,TRUE
1014,Hokkaido is to the north of Honshu.,北海道在日本本州的北部。,,地點,321287,887907,11,10,17.7,TRUE
1016,I intend to study abroad next year.,我打算明年出國留學。,,地點,262169,881261,6,10,14.2,TRUE
1017,Studying abroad is very common now.,現在出國留學是很常見的。,,地點,241937,801304,4,10,12.8,TRUE
1018,The baby fell asleep in the cradle.,寶寶在搖籃裡入睡了。,,地點,45825,336584,6,9,13.2,TRUE
1019,The boy has an apple in his pocket.,這男孩的口袋裡有個蘋果。,,地點,46385,335404,1,9,9.7,TRUE
1020,The library is on the second floor.,圖書館在二樓。,,地點,270698,895594,3,10,12.1,TRUE
1021,The oranges in this bag are rotten.,這個袋子裡的柳橙都爛了。,,地點,57999,904919,4,10,12.8,TRUE
1022,There are many stores in this area.,這個區域裡有很多商店。,,地點,57921,900227,2,10,11.4,TRUE
1024,There is a television in this room.,這個房間裡有台電視。,,地點,57350,333126,3,10,12.1,TRUE
1025,We have a door between our offices.,我們的辦公室之間有扇門。,,地點,2712823,6293103,1,10,10.7,TRUE
1026,Yesterday I met Mary on the street.,昨天我在街上遇見了瑪麗。,,地點,244638,902927,2,10,11.4,TRUE
1028,He was sitting between Mary and Tom.,他坐在瑪麗和湯姆之間。,,地點,293011,880244,3,10,12.1,TRUE
1029,I looked for him in the supermarket.,我在超級市場裡找他。,,地點,253948,848695,1,11,11.7,TRUE
1030,It became quiet again in the forest.,森林裡又再度安靜下來了。,,地點,269486,801338,3,10,12.1,TRUE
1031,The calculator on the table is mine.,桌上的計算機是我的。,,地點,39596,464855,5,10,13.5,TRUE
1032,There was hardly anyone in the room.,房間裡幾乎沒有人。,,地點,319489,801451,3,9,11.1,TRUE
1033,"Father is out, but Mother is at home.",爸爸出去了，但媽媽在家。,,地點,319272,334240,3,10,12.1,TRUE
1034,He felt in his pocket for his wallet.,他摸摸口袋找錢包。,,地點,292731,336951,4,10,12.8,TRUE
1036,I am getting off at the next station.,我下一站下車。,,地點,258187,375320,3,10,12.1,TRUE
1037,I arrived at the village before dark.,我天黑之前到達了村莊。,,地點,336059,336106,3,11,13.1,TRUE
1038,I enjoyed driving on the new highway.,我很喜歡在新的高速公路上開車。,,地點,258804,885524,3,12,14.1,TRUE
1039,I kept the $20 I found in the street.,我留下了在街上發現的20美元。,,地點,681287,795458,4,10,12.8,TRUE
1041,My aunt grows tomatoes in her garden.,我阿姨在她的花園裡種蕃茄。,,地點,250270,802014,3,10,12.1,TRUE
1042,She put the dirty dishes in the sink.,她把髒盤子放進水槽裡。,,地點,312724,866752,4,10,12.8,TRUE
1043,There is a village over the mountain.,在山頂上有一座村莊。,,地點,245058,918372,1,10,10.7,TRUE
1044,There was no money left in my wallet.,我錢包裡沒錢了。,,地點,244276,335396,4,10,12.8,TRUE
1045,Tom is used to cooking on a campfire.,湯姆習慣用營火做菜。,,地點,1024784,1261406,9,12,18.3,TRUE
1046,We had lunch at a little coffee shop.,我們在一家小咖啡廳吃午飯。,,地點,715731,6145387,0,8,8,TRUE
1047,I have numerous books on my bookshelf.,我有大量的書在我的書架上。,,地點,1697745,1695387,11,10,17.7,TRUE
1048,I haven't seen you around here before.,我以前在這裡沒見過你。,,地點,2360289,5863293,2,10,11.4,TRUE
1049,She put her CDs in a row on the shelf.,她把她的CD在書架上排成一排。,,地點,310226,897290,7,10,14.9,TRUE
1050,Talking in the library is not allowed.,不准在圖書館裡講話。,,地點,270676,798325,3,12,14.1,TRUE
1051,There weren't any roses in the garden.,花園裡沒有任何玫瑰。,,地點,44966,798301,3,11,13.1,TRUE
1052,We had an unpleasant experience there.,我們在那裡有一個不太愉快的經歷。,,地點,262527,796043,4,10,12.8,TRUE
1053,You are not authorized to enter there.,你無權進入那裡。,,地點,2162140,2161712,8,11,16.6,TRUE
1054,You can see a lot of stars in the sky.,你可以看到天空中的繁星。,,地點,18331,1878288,1,10,10.7,TRUE
1055,A man suddenly appeared in the doorway.,一個男的突然出現在門口。,,地點,280708,3780486,8,12,17.6,TRUE
1056,All the flowers in the garden withered.,所有花園裡的花朵都枯萎了。,,地點,278491,798292,0,11,11,TRUE
1057,He is a waiter in a seaside restaurant.,他是一家海濱餐廳的服務員。,,地點,294691,5958725,8,12,17.6,TRUE
1058,He's a professor of biology at Harvard.,他是哈佛大學的生物學教授。,,地點,292356,332645,13,13,22.1,TRUE
1059,Her house is at the foot of a mountain.,她家在一座山的山腳下。,,地點,309102,799197,1,10,10.7,TRUE
1060,I can't imagine life on another planet.,我無法想像另一個星球上的生物。,,地點,259264,332481,5,13,16.5,TRUE
1061,I found a beautiful shell on the shore.,我在海灘上發現了一個漂亮的貝殼。,,地點,256744,1358441,5,10,13.5,TRUE
1062,I went swimming in the river yesterday.,我昨天去河裡游泳了。,,地點,257787,335679,0,11,11,TRUE
1063,The accident took place at that corner.,事故發生在轉角。,,地點,47119,4732054,3,10,12.1,TRUE
1065,There is a beautiful park near my home.,我家附近有座漂亮的公園。,,地點,250500,333150,1,10,10.7,TRUE
1066,There was a castle here many years ago.,許多年前這裡有一座城堡。,,地點,272129,808265,4,10,12.8,TRUE
1067,Tom hung his jacket in the hall closet.,湯姆把他的夾克掛在大廳衣櫃裡。,,地點,1093523,5624956,5,10,13.5,TRUE
1068,We arrived at a small town in Hokkaido.,我們到達了北海道的一個小鎮。,,地點,249375,1395005,5,12,15.5,TRUE
1070,You're not supposed to be in this area.,你不應該待在這裡。,,地點,2835585,3770515,5,11,14.5,TRUE
1071,He objected to his wife working outside.,他反對妻子外出工作。,,地點,296771,2080585,4,11,13.8,TRUE
1073,I was at home most of the day yesterday.,我昨天大部分時間在家。,,地點,2611896,5624924,2,11,12.4,TRUE
1074,I'm studying at the University of Hyogo.,我在兵庫縣立大學學習。,,地點,452961,1706454,12,13,21.4,TRUE
1075,No one lived on the island at that time.,那個時候，沒有人在這個島上生活。,,地點,279912,2007051,2,11,12.4,TRUE
1076,Our school is in the center of the town.,我們學校在市中心。,,地點,247488,333499,2,10,11.4,TRUE
1078,Somebody had drowned her in the bathtub.,有人把她淹死在浴缸裡。,,地點,24545,805059,12,12,20.4,TRUE
1079,Sydney is the largest city in Australia.,雪梨是澳洲最大的城市。,,地點,53449,798317,8,11,16.6,TRUE
1081,There are a lot of books in the library.,圖書館裡有很多書。,,地點,270688,1260555,1,11,11.7,TRUE
1082,There are seven continents on the earth.,地球上有七大洲。,,地點,271117,2109213,5,10,13.5,TRUE
1083,There is a bank in front of the station.,車站前有個銀行。,,地點,25970,336972,2,10,11.4,TRUE
1084,There wasn't any furniture in that room.,那個房間裡沒有任何傢俱。,,地點,503778,907501,5,11,14.5,TRUE
1085,They live on the other side of the road.,他們住在路對面。,,地點,307254,6103122,3,10,12.1,TRUE
1086,Tom had a lot of problems at the school.,湯姆在學校遇到了很多問題。,,地點,1093872,5091311,2,10,11.4,TRUE
1087,Tom is in the other room drinking vodka.,湯姆在別的房間喝伏特加。,,地點,1868199,5418706,6,11,15.2,TRUE
1088,We are not short of oil in this country.,我們國家不缺石油。,,地點,23470,332861,3,11,13.1,TRUE
1089,We met in a coffee shop near the campus.,我們在校園附近的咖啡廳碰面。,,地點,1893779,5418959,3,10,12.1,TRUE
1091,His office is past the bank on your left.,經過銀行，左邊就是他的辦公室了。,,地點,286530,487705,2,10,11.4,TRUE
1093,I had my teeth examined at the dentist's.,我在牙醫那兒檢查了牙齒。,,地點,258089,390840,5,12,15.5,TRUE
1096,It was in Beijing that I studied Chinese.,我是在北京學的中文。,,地點,844672,859024,11,11,18.7,TRUE
1097,The library is in the middle of the city.,圖書館位於市中心。,,地點,270703,1506818,2,12,13.4,TRUE
1102,Tom criticized Mary in front of everyone.,湯姆在所有人面前批評了瑪麗。,,地點,1095016,2027917,6,13,17.2,TRUE
1103,We can't go outside because it's raining.,因為下雨，我們不能出去。,,地點,1360700,481162,3,11,13.1,TRUE
1104,You must go outside if you want to smoke.,如果您想抽煙的話，您必須出去。,,地點,681536,784569,3,10,12.1,TRUE
1105,Aren't you supposed to be at school today?,你今天不是應該在學校嗎？,,地點,242802,2092361,5,12,15.5,TRUE
1106,Children really like playing on the beach.,孩子們非常喜歡在海灘上玩耍。,,地點,1164967,844153,1,11,11.7,TRUE
1107,Countless stars were twinkling in the sky.,無數星星在天上閃爍。,,地點,18312,5767608,6,10,14.2,TRUE
1108,He has spent ten years in jail for murder.,他因為謀殺案在牢裡待了十年。,,地點,1334559,5505597,7,10,14.9,TRUE
1109,I can't adjust myself to the climate here.,我不能適應這裡的氣候。,,地點,2264264,6091818,7,11,15.9,TRUE
1110,I found something interesting in the town.,我發現了鎮上一些有趣的事。,,地點,327851,805044,4,12,14.8,TRUE
1111,I picked up a pretty shell at the seaside.,我在海邊撿了個漂亮的貝殼。,,地點,500169,5911660,11,12,19.7,TRUE
1112,I want to show you something in my office.,我想給你看看我辦公室裡的一些東西。,,地點,2590916,7774814,2,12,13.4,TRUE
1113,I wrote the wrong address on the envelope.,我在信封上寫錯了地址。,,地點,682501,816527,3,11,13.1,TRUE
1114,Is there central heating in this building?,這棟大樓有中央暖氣系統嗎？,,地點,1088103,4764531,4,10,12.8,TRUE
1115,Many children die of starvation in Africa.,在非洲有許多孩子死於飢餓。,,地點,67760,334868,10,13,20,TRUE
1117,People in the United States speak English.,在美國的人說英語。,,地點,882579,811889,3,11,13.1,TRUE
1118,She stayed in that area for a short while.,她在那地方待了一陣子。,,地點,634344,5983686,3,12,14.1,TRUE
1119,The girl wore a yellow ribbon in her hair.,那女孩的頭髮上綁了一條黃絲帶。,,地點,46633,334126,4,11,13.8,TRUE
1120,The river's on the other side of the hill.,河在山丘的另一端。,,地點,2268495,6109322,3,11,13.1,TRUE
1121,There are a lot of new buildings here now.,這裡現在有了許多新建築。,,地點,241838,5624986,3,10,12.1,TRUE
1122,There are many different people in Europe.,在歐洲有許多不同的人。,,地點,703082,5763027,5,11,14.5,TRUE
1123,There are some strange animals in the zoo.,動物園裡有很多奇怪的動物。,,地點,44694,2482672,3,10,12.1,TRUE
1124,They give good service at that restaurant.,那家餐廳的服務很好。,,地點,68592,804980,2,10,11.4,TRUE
1126,Tom and Mary switched places on the bench.,湯姆和瑪麗在長凳上交換了位置。,,地點,2538348,5842612,5,11,14.5,TRUE
1127,Tom planted three apple trees in his yard.,湯姆在他的院子裡種了三棵蘋果樹。,,地點,1024346,4970104,4,9,11.8,TRUE
1128,We don't want any freeloaders around here.,我們不希望有人在這裡吃霸王餐。,,地點,529638,1227134,9,12,18.3,TRUE
1129,He is richer than anyone else in this town.,他比鎮上的其他人都有錢。,,地點,289937,5931767,3,11,13.1,TRUE
1131,I had no choice but to stay in bed all day.,我不得不一整天都躺在床上。,,地點,437965,408257,2,11,12.4,TRUE
1132,I have no idea of what's going on in there.,我不清楚這裡發生了什麼事。,,地點,1877163,5350410,1,11,11.7,TRUE
1133,I want to stay in a hotel near the airport.,我想住在機場附近的旅館裡。,,地點,1242858,1241329,0,12,12,TRUE
1134,It's very hard getting a taxi in this city.,在這個城市，很難招到計程車。,,地點,1209574,1416167,2,13,14.4,TRUE
1135,My ex-husband no longer lives in this city.,我前夫不再住在這個城市了。,,地點,251802,778484,8,13,18.6,TRUE
1136,My grandfather's photograph is on the wall.,我祖父的照片在牆上掛著。,,地點,2841161,5983610,3,11,13.1,TRUE
1137,The bike parked over there is my brother's.,那邊停著的那輛自行車是我哥哥的。,,地點,1401800,785045,1,11,11.7,TRUE
1138,This summer I went on vacation in Scotland.,這個夏天，我去蘇格蘭度假了。,,地點,708390,710307,9,12,18.3,TRUE
1139,"Tom isn't here yet, but we expect him soon.",湯姆還不在這裡，但我們期待他很快就來。,,地點,1024696,6624716,4,11,13.8,TRUE
1140,Are there any famous musicians on the stage?,舞台上有著名的音樂家嗎？,,地點,319458,333013,6,12,16.2,TRUE
1141,He's a professor at the National University.,他是國立大學的教授。,,地點,2258573,4473128,10,15,22,TRUE
1142,I need to find out when we need to be there.,我需要知道我們什麼時候需要到那裡。,,地點,2387601,5869912,3,11,13.1,TRUE
1143,My parents have just arrived at the station.,我的父母剛剛到達車站。,,地點,325699,809766,4,12,14.8,TRUE
1144,My uncle has a flower shop near the station.,我叔叔在車站附近有一家花店。,,地點,65070,789982,0,11,11,TRUE
1145,She was holding a small parasol in her hand.,她手裡握著一把小陽傘。,,地點,1180732,835553,9,12,18.3,TRUE
1146,There are no hats in that store that fit me.,那個店裡沒有合我尺寸的帽子。,,地點,2681957,2661328,3,10,12.1,TRUE
1147,There was a cottage on the side of the hill.,山坡上有一個茅屋。,,地點,48731,847789,6,11,15.2,TRUE
